[ Fri Oct 11 15:36:08 2024 ] using warm up, epoch: 5
[ Fri Oct 11 15:36:36 2024 ] Parameters:
{'work_dir': './work_dir/uav/ctrgcn_bone_v2', 'model_saved_name': './work_dir/uav/ctrgcn_bone_v2/runs', 'config': 'config/uav/bone.yaml', 'phase': 'train', 'save_score': False, 'seed': 1, 'log_interval': 100, 'save_interval': 1, 'save_epoch': 30, 'eval_interval': 5, 'print_log': True, 'show_topk': [1, 5], 'feeder': 'feeders.feeder_uav.Feeder', 'num_worker': 8, 'train_feeder_args': {'data_path': 'data/uav/v2/train_joint.npy', 'label_path': 'data/uav/v2/train_label.npy', 'debug': False, 'random_choose': False, 'random_shift': False, 'random_move': False, 'window_size': 120, 'normalization': True, 'random_rot': True, 'p_interval': [0.5, 1], 'vel': False, 'bone': True}, 'test_feeder_args': {'data_path': 'data/uav/v2/test_joint_A.npy', 'label_path': 'data/uav/v2/test_label_A.npy', 'window_size': 120, 'p_interval': [0.95], 'vel': False, 'bone': True, 'debug': False, 'normalization': True}, 'model': 'model.ctrgcn.Model', 'model_args': {'num_class': 155, 'num_point': 17, 'num_person': 2, 'graph': 'graph.uav_human.Graph', 'graph_args': {'labeling_mode': 'spatial'}}, 'weights': None, 'ignore_weights': [], 'base_lr': 0.1, 'min_lr': 0.0001, 'step': [35, 55], 'device': [0], 'optimizer': 'SGD', 'nesterov': True, 'batch_size': 64, 'test_batch_size': 128, 'start_epoch': 0, 'num_epoch': 65, 'weight_decay': 0.0004, 'lr_decay_rate': 0.1, 'warm_up_epoch': 5}

[ Fri Oct 11 15:36:36 2024 ] # Parameters: 1460911
[ Fri Oct 11 15:36:36 2024 ] Training epoch: 1
[ Fri Oct 11 15:46:43 2024 ] 	Mean training loss: 4.7763.  Mean training acc: 2.12%.
[ Fri Oct 11 15:46:43 2024 ] 	Time consumption: [Data]02%, [Network]98%
[ Fri Oct 11 15:46:43 2024 ] Eval epoch: 1
[ Fri Oct 11 15:47:48 2024 ] 	Mean test loss of 16 batches: 4.455574780702591.
[ Fri Oct 11 15:47:48 2024 ] 	Top1: 2.35%
[ Fri Oct 11 15:47:48 2024 ] 	Top5: 12.90%
[ Fri Oct 11 15:47:48 2024 ] Training epoch: 2
[ Fri Oct 11 15:57:46 2024 ] 	Mean training loss: 4.4529.  Mean training acc: 3.84%.
[ Fri Oct 11 15:57:46 2024 ] 	Time consumption: [Data]02%, [Network]98%
[ Fri Oct 11 15:57:46 2024 ] Eval epoch: 2
[ Fri Oct 11 15:58:48 2024 ] 	Mean test loss of 16 batches: 3.9183389991521835.
[ Fri Oct 11 15:58:48 2024 ] 	Top1: 7.65%
[ Fri Oct 11 15:58:48 2024 ] 	Top5: 26.75%
[ Fri Oct 11 15:58:48 2024 ] Training epoch: 3
[ Fri Oct 11 16:08:55 2024 ] 	Mean training loss: 3.9160.  Mean training acc: 8.23%.
[ Fri Oct 11 16:08:55 2024 ] 	Time consumption: [Data]02%, [Network]98%
[ Fri Oct 11 16:08:55 2024 ] Eval epoch: 3
[ Fri Oct 11 16:09:59 2024 ] 	Mean test loss of 16 batches: 3.2626502960920334.
[ Fri Oct 11 16:09:59 2024 ] 	Top1: 15.20%
[ Fri Oct 11 16:09:59 2024 ] 	Top5: 45.05%
[ Fri Oct 11 16:09:59 2024 ] Training epoch: 4
[ Fri Oct 11 16:19:59 2024 ] 	Mean training loss: 3.4574.  Mean training acc: 14.29%.
[ Fri Oct 11 16:19:59 2024 ] 	Time consumption: [Data]02%, [Network]98%
[ Fri Oct 11 16:19:59 2024 ] Eval epoch: 4
[ Fri Oct 11 16:21:02 2024 ] 	Mean test loss of 16 batches: 2.828189104795456.
[ Fri Oct 11 16:21:02 2024 ] 	Top1: 24.10%
[ Fri Oct 11 16:21:02 2024 ] 	Top5: 58.85%
[ Fri Oct 11 16:21:02 2024 ] Training epoch: 5
[ Fri Oct 11 16:31:03 2024 ] 	Mean training loss: 3.1572.  Mean training acc: 19.95%.
[ Fri Oct 11 16:31:03 2024 ] 	Time consumption: [Data]02%, [Network]98%
[ Fri Oct 11 16:31:03 2024 ] Eval epoch: 5
[ Fri Oct 11 16:32:03 2024 ] 	Mean test loss of 16 batches: 2.5354779958724976.
[ Fri Oct 11 16:32:03 2024 ] 	Top1: 30.30%
[ Fri Oct 11 16:32:03 2024 ] 	Top5: 68.95%
[ Fri Oct 11 16:32:03 2024 ] Training epoch: 6
[ Fri Oct 11 16:42:01 2024 ] 	Mean training loss: 2.8911.  Mean training acc: 24.78%.
[ Fri Oct 11 16:42:01 2024 ] 	Time consumption: [Data]02%, [Network]98%
[ Fri Oct 11 16:42:01 2024 ] Eval epoch: 6
[ Fri Oct 11 16:43:02 2024 ] 	Mean test loss of 16 batches: 2.2287672534585.
[ Fri Oct 11 16:43:02 2024 ] 	Top1: 36.35%
[ Fri Oct 11 16:43:02 2024 ] 	Top5: 74.40%
[ Fri Oct 11 16:43:02 2024 ] Training epoch: 7
[ Fri Oct 11 16:53:01 2024 ] 	Mean training loss: 2.6882.  Mean training acc: 30.09%.
[ Fri Oct 11 16:53:01 2024 ] 	Time consumption: [Data]02%, [Network]98%
[ Fri Oct 11 16:53:01 2024 ] Eval epoch: 7
[ Fri Oct 11 16:54:04 2024 ] 	Mean test loss of 16 batches: 2.040036417543888.
[ Fri Oct 11 16:54:04 2024 ] 	Top1: 41.55%
[ Fri Oct 11 16:54:04 2024 ] 	Top5: 79.75%
[ Fri Oct 11 16:54:04 2024 ] Training epoch: 8
[ Fri Oct 11 17:04:04 2024 ] 	Mean training loss: 2.5420.  Mean training acc: 32.91%.
[ Fri Oct 11 17:04:04 2024 ] 	Time consumption: [Data]02%, [Network]98%
[ Fri Oct 11 17:04:04 2024 ] Eval epoch: 8
[ Fri Oct 11 17:05:05 2024 ] 	Mean test loss of 16 batches: 2.220887176692486.
[ Fri Oct 11 17:05:05 2024 ] 	Top1: 39.85%
[ Fri Oct 11 17:05:05 2024 ] 	Top5: 75.50%
[ Fri Oct 11 17:05:05 2024 ] Training epoch: 9
[ Fri Oct 11 17:15:04 2024 ] 	Mean training loss: 2.4434.  Mean training acc: 35.08%.
[ Fri Oct 11 17:15:04 2024 ] 	Time consumption: [Data]02%, [Network]98%
[ Fri Oct 11 17:15:04 2024 ] Eval epoch: 9
[ Fri Oct 11 17:16:07 2024 ] 	Mean test loss of 16 batches: 2.068743474781513.
[ Fri Oct 11 17:16:07 2024 ] 	Top1: 41.25%
[ Fri Oct 11 17:16:07 2024 ] 	Top5: 79.10%
[ Fri Oct 11 17:16:07 2024 ] Training epoch: 10
[ Fri Oct 11 17:26:04 2024 ] 	Mean training loss: 2.3545.  Mean training acc: 37.22%.
[ Fri Oct 11 17:26:04 2024 ] 	Time consumption: [Data]02%, [Network]98%
[ Fri Oct 11 17:26:04 2024 ] Eval epoch: 10
[ Fri Oct 11 17:27:07 2024 ] 	Mean test loss of 16 batches: 1.9022949039936066.
[ Fri Oct 11 17:27:07 2024 ] 	Top1: 45.60%
[ Fri Oct 11 17:27:07 2024 ] 	Top5: 79.75%
[ Fri Oct 11 17:27:07 2024 ] Training epoch: 11
[ Fri Oct 11 17:37:07 2024 ] 	Mean training loss: 2.2809.  Mean training acc: 39.17%.
[ Fri Oct 11 17:37:07 2024 ] 	Time consumption: [Data]02%, [Network]98%
[ Fri Oct 11 17:37:07 2024 ] Eval epoch: 11
[ Fri Oct 11 17:38:08 2024 ] 	Mean test loss of 16 batches: 1.9095391258597374.
[ Fri Oct 11 17:38:08 2024 ] 	Top1: 46.45%
[ Fri Oct 11 17:38:08 2024 ] 	Top5: 82.25%
[ Fri Oct 11 17:38:08 2024 ] Training epoch: 12
[ Fri Oct 11 17:48:13 2024 ] 	Mean training loss: 2.2137.  Mean training acc: 41.05%.
[ Fri Oct 11 17:48:13 2024 ] 	Time consumption: [Data]02%, [Network]98%
[ Fri Oct 11 17:48:13 2024 ] Eval epoch: 12
[ Fri Oct 11 17:49:16 2024 ] 	Mean test loss of 16 batches: 1.8636419773101807.
[ Fri Oct 11 17:49:16 2024 ] 	Top1: 45.95%
[ Fri Oct 11 17:49:16 2024 ] 	Top5: 81.60%
[ Fri Oct 11 17:49:16 2024 ] Training epoch: 13
[ Fri Oct 11 17:59:13 2024 ] 	Mean training loss: 2.1766.  Mean training acc: 41.30%.
[ Fri Oct 11 17:59:13 2024 ] 	Time consumption: [Data]02%, [Network]98%
[ Fri Oct 11 17:59:13 2024 ] Eval epoch: 13
[ Fri Oct 11 18:00:16 2024 ] 	Mean test loss of 16 batches: 1.8257612362504005.
[ Fri Oct 11 18:00:16 2024 ] 	Top1: 49.85%
[ Fri Oct 11 18:00:16 2024 ] 	Top5: 82.45%
[ Fri Oct 11 18:00:16 2024 ] Training epoch: 14
[ Fri Oct 11 18:10:16 2024 ] 	Mean training loss: 2.1225.  Mean training acc: 43.27%.
[ Fri Oct 11 18:10:16 2024 ] 	Time consumption: [Data]02%, [Network]98%
[ Fri Oct 11 18:10:16 2024 ] Eval epoch: 14
[ Fri Oct 11 18:11:17 2024 ] 	Mean test loss of 16 batches: 1.6961952820420265.
[ Fri Oct 11 18:11:17 2024 ] 	Top1: 52.45%
[ Fri Oct 11 18:11:17 2024 ] 	Top5: 84.65%
[ Fri Oct 11 18:11:17 2024 ] Training epoch: 15
[ Fri Oct 11 18:21:17 2024 ] 	Mean training loss: 2.0830.  Mean training acc: 44.22%.
[ Fri Oct 11 18:21:17 2024 ] 	Time consumption: [Data]02%, [Network]98%
[ Fri Oct 11 18:21:17 2024 ] Eval epoch: 15
[ Fri Oct 11 18:22:21 2024 ] 	Mean test loss of 16 batches: 1.6626207754015923.
[ Fri Oct 11 18:22:21 2024 ] 	Top1: 51.40%
[ Fri Oct 11 18:22:21 2024 ] 	Top5: 85.50%
[ Fri Oct 11 18:22:21 2024 ] Training epoch: 16
[ Fri Oct 11 18:32:17 2024 ] 	Mean training loss: 2.0465.  Mean training acc: 45.16%.
[ Fri Oct 11 18:32:17 2024 ] 	Time consumption: [Data]02%, [Network]98%
[ Fri Oct 11 18:32:17 2024 ] Eval epoch: 16
[ Fri Oct 11 18:33:20 2024 ] 	Mean test loss of 16 batches: 1.8307008817791939.
[ Fri Oct 11 18:33:20 2024 ] 	Top1: 50.10%
[ Fri Oct 11 18:33:20 2024 ] 	Top5: 81.20%
[ Fri Oct 11 18:33:20 2024 ] Training epoch: 17
[ Fri Oct 11 18:43:18 2024 ] 	Mean training loss: 2.0197.  Mean training acc: 45.52%.
[ Fri Oct 11 18:43:18 2024 ] 	Time consumption: [Data]02%, [Network]98%
[ Fri Oct 11 18:43:18 2024 ] Eval epoch: 17
[ Fri Oct 11 18:44:21 2024 ] 	Mean test loss of 16 batches: 1.9329241886734962.
[ Fri Oct 11 18:44:21 2024 ] 	Top1: 48.00%
[ Fri Oct 11 18:44:21 2024 ] 	Top5: 81.95%
[ Fri Oct 11 18:44:21 2024 ] Training epoch: 18
[ Fri Oct 11 18:54:21 2024 ] 	Mean training loss: 1.9829.  Mean training acc: 46.72%.
[ Fri Oct 11 18:54:21 2024 ] 	Time consumption: [Data]02%, [Network]98%
[ Fri Oct 11 18:54:21 2024 ] Eval epoch: 18
[ Fri Oct 11 18:55:22 2024 ] 	Mean test loss of 16 batches: 1.6249925196170807.
[ Fri Oct 11 18:55:22 2024 ] 	Top1: 54.70%
[ Fri Oct 11 18:55:22 2024 ] 	Top5: 85.20%
[ Fri Oct 11 18:55:22 2024 ] Training epoch: 19
[ Fri Oct 11 19:05:23 2024 ] 	Mean training loss: 1.9618.  Mean training acc: 46.79%.
[ Fri Oct 11 19:05:23 2024 ] 	Time consumption: [Data]02%, [Network]98%
[ Fri Oct 11 19:05:23 2024 ] Eval epoch: 19
[ Fri Oct 11 19:06:27 2024 ] 	Mean test loss of 16 batches: 1.5426121801137924.
[ Fri Oct 11 19:06:27 2024 ] 	Top1: 55.50%
[ Fri Oct 11 19:06:27 2024 ] 	Top5: 87.65%
[ Fri Oct 11 19:06:27 2024 ] Training epoch: 20
[ Fri Oct 11 19:16:26 2024 ] 	Mean training loss: 1.9245.  Mean training acc: 48.08%.
[ Fri Oct 11 19:16:26 2024 ] 	Time consumption: [Data]02%, [Network]98%
[ Fri Oct 11 19:16:26 2024 ] Eval epoch: 20
[ Fri Oct 11 19:17:29 2024 ] 	Mean test loss of 16 batches: 2.131585583090782.
[ Fri Oct 11 19:17:29 2024 ] 	Top1: 45.05%
[ Fri Oct 11 19:17:30 2024 ] 	Top5: 77.30%
[ Fri Oct 11 19:17:30 2024 ] Training epoch: 21
[ Fri Oct 11 19:27:29 2024 ] 	Mean training loss: 1.9025.  Mean training acc: 48.84%.
[ Fri Oct 11 19:27:29 2024 ] 	Time consumption: [Data]02%, [Network]98%
[ Fri Oct 11 19:27:29 2024 ] Eval epoch: 21
[ Fri Oct 11 19:28:31 2024 ] 	Mean test loss of 16 batches: 1.796766560524702.
[ Fri Oct 11 19:28:31 2024 ] 	Top1: 51.65%
[ Fri Oct 11 19:28:31 2024 ] 	Top5: 84.20%
[ Fri Oct 11 19:28:31 2024 ] Training epoch: 22
[ Fri Oct 11 19:38:31 2024 ] 	Mean training loss: 1.8858.  Mean training acc: 49.11%.
[ Fri Oct 11 19:38:31 2024 ] 	Time consumption: [Data]02%, [Network]98%
[ Fri Oct 11 19:38:31 2024 ] Eval epoch: 22
[ Fri Oct 11 19:39:33 2024 ] 	Mean test loss of 16 batches: 1.970423847436905.
[ Fri Oct 11 19:39:33 2024 ] 	Top1: 49.15%
[ Fri Oct 11 19:39:34 2024 ] 	Top5: 80.25%
[ Fri Oct 11 19:39:34 2024 ] Training epoch: 23
[ Fri Oct 11 19:49:28 2024 ] 	Mean training loss: 1.8577.  Mean training acc: 50.23%.
[ Fri Oct 11 19:49:28 2024 ] 	Time consumption: [Data]02%, [Network]98%
[ Fri Oct 11 19:49:28 2024 ] Eval epoch: 23
[ Fri Oct 11 19:50:30 2024 ] 	Mean test loss of 16 batches: 1.720561422407627.
[ Fri Oct 11 19:50:30 2024 ] 	Top1: 55.40%
[ Fri Oct 11 19:50:30 2024 ] 	Top5: 84.35%
[ Fri Oct 11 19:50:30 2024 ] Training epoch: 24
[ Fri Oct 11 20:00:35 2024 ] 	Mean training loss: 1.8421.  Mean training acc: 50.03%.
[ Fri Oct 11 20:00:35 2024 ] 	Time consumption: [Data]02%, [Network]98%
[ Fri Oct 11 20:00:35 2024 ] Eval epoch: 24
[ Fri Oct 11 20:01:37 2024 ] 	Mean test loss of 16 batches: 1.5953119397163391.
[ Fri Oct 11 20:01:37 2024 ] 	Top1: 54.60%
[ Fri Oct 11 20:01:37 2024 ] 	Top5: 86.50%
[ Fri Oct 11 20:01:37 2024 ] Training epoch: 25
[ Fri Oct 11 20:11:39 2024 ] 	Mean training loss: 1.8199.  Mean training acc: 50.35%.
[ Fri Oct 11 20:11:39 2024 ] 	Time consumption: [Data]02%, [Network]98%
[ Fri Oct 11 20:11:39 2024 ] Eval epoch: 25
[ Fri Oct 11 20:12:41 2024 ] 	Mean test loss of 16 batches: 1.5444075167179108.
[ Fri Oct 11 20:12:41 2024 ] 	Top1: 55.60%
[ Fri Oct 11 20:12:41 2024 ] 	Top5: 86.50%
[ Fri Oct 11 20:12:41 2024 ] Training epoch: 26
[ Fri Oct 11 20:22:42 2024 ] 	Mean training loss: 1.8116.  Mean training acc: 51.08%.
[ Fri Oct 11 20:22:42 2024 ] 	Time consumption: [Data]02%, [Network]98%
[ Fri Oct 11 20:22:42 2024 ] Eval epoch: 26
[ Fri Oct 11 20:23:44 2024 ] 	Mean test loss of 16 batches: 2.192475453019142.
[ Fri Oct 11 20:23:44 2024 ] 	Top1: 45.75%
[ Fri Oct 11 20:23:44 2024 ] 	Top5: 77.05%
[ Fri Oct 11 20:23:44 2024 ] Training epoch: 27
[ Fri Oct 11 20:33:45 2024 ] 	Mean training loss: 1.7831.  Mean training acc: 51.49%.
[ Fri Oct 11 20:33:45 2024 ] 	Time consumption: [Data]02%, [Network]98%
[ Fri Oct 11 20:33:45 2024 ] Eval epoch: 27
[ Fri Oct 11 20:34:47 2024 ] 	Mean test loss of 16 batches: 1.4967168755829334.
[ Fri Oct 11 20:34:47 2024 ] 	Top1: 58.00%
[ Fri Oct 11 20:34:47 2024 ] 	Top5: 87.45%
[ Fri Oct 11 20:34:47 2024 ] Training epoch: 28
[ Fri Oct 11 20:44:45 2024 ] 	Mean training loss: 1.7854.  Mean training acc: 51.25%.
[ Fri Oct 11 20:44:45 2024 ] 	Time consumption: [Data]02%, [Network]98%
[ Fri Oct 11 20:44:45 2024 ] Eval epoch: 28
[ Fri Oct 11 20:45:46 2024 ] 	Mean test loss of 16 batches: 1.5190031304955482.
[ Fri Oct 11 20:45:46 2024 ] 	Top1: 55.45%
[ Fri Oct 11 20:45:46 2024 ] 	Top5: 88.05%
[ Fri Oct 11 20:45:46 2024 ] Training epoch: 29
[ Fri Oct 11 20:55:44 2024 ] 	Mean training loss: 1.7618.  Mean training acc: 51.76%.
[ Fri Oct 11 20:55:44 2024 ] 	Time consumption: [Data]02%, [Network]98%
[ Fri Oct 11 20:55:44 2024 ] Eval epoch: 29
[ Fri Oct 11 20:56:47 2024 ] 	Mean test loss of 16 batches: 1.6406573578715324.
[ Fri Oct 11 20:56:47 2024 ] 	Top1: 55.45%
[ Fri Oct 11 20:56:47 2024 ] 	Top5: 86.40%
[ Fri Oct 11 20:56:47 2024 ] Training epoch: 30
[ Fri Oct 11 21:06:45 2024 ] 	Mean training loss: 1.7409.  Mean training acc: 52.95%.
[ Fri Oct 11 21:06:45 2024 ] 	Time consumption: [Data]02%, [Network]98%
[ Fri Oct 11 21:06:45 2024 ] Eval epoch: 30
[ Fri Oct 11 21:07:47 2024 ] 	Mean test loss of 16 batches: 1.4908923469483852.
[ Fri Oct 11 21:07:47 2024 ] 	Top1: 58.45%
[ Fri Oct 11 21:07:47 2024 ] 	Top5: 87.05%
[ Fri Oct 11 21:07:48 2024 ] Training epoch: 31
[ Fri Oct 11 21:17:52 2024 ] 	Mean training loss: 1.7169.  Mean training acc: 53.25%.
[ Fri Oct 11 21:17:52 2024 ] 	Time consumption: [Data]02%, [Network]98%
[ Fri Oct 11 21:17:52 2024 ] Eval epoch: 31
[ Fri Oct 11 21:18:53 2024 ] 	Mean test loss of 16 batches: 1.5199385769665241.
[ Fri Oct 11 21:18:53 2024 ] 	Top1: 56.60%
[ Fri Oct 11 21:18:53 2024 ] 	Top5: 87.55%
[ Fri Oct 11 21:18:53 2024 ] Training epoch: 32
[ Fri Oct 11 21:28:50 2024 ] 	Mean training loss: 1.7072.  Mean training acc: 54.02%.
[ Fri Oct 11 21:28:50 2024 ] 	Time consumption: [Data]02%, [Network]98%
[ Fri Oct 11 21:28:50 2024 ] Eval epoch: 32
[ Fri Oct 11 21:29:52 2024 ] 	Mean test loss of 16 batches: 1.496879730373621.
[ Fri Oct 11 21:29:52 2024 ] 	Top1: 59.10%
[ Fri Oct 11 21:29:52 2024 ] 	Top5: 89.05%
[ Fri Oct 11 21:29:52 2024 ] Training epoch: 33
[ Fri Oct 11 21:39:53 2024 ] 	Mean training loss: 1.6979.  Mean training acc: 53.74%.
[ Fri Oct 11 21:39:53 2024 ] 	Time consumption: [Data]02%, [Network]98%
[ Fri Oct 11 21:39:53 2024 ] Eval epoch: 33
[ Fri Oct 11 21:40:54 2024 ] 	Mean test loss of 16 batches: 1.5451726242899895.
[ Fri Oct 11 21:40:54 2024 ] 	Top1: 58.75%
[ Fri Oct 11 21:40:54 2024 ] 	Top5: 87.10%
[ Fri Oct 11 21:40:54 2024 ] Training epoch: 34
[ Fri Oct 11 21:50:55 2024 ] 	Mean training loss: 1.6936.  Mean training acc: 54.06%.
[ Fri Oct 11 21:50:55 2024 ] 	Time consumption: [Data]02%, [Network]98%
[ Fri Oct 11 21:50:55 2024 ] Eval epoch: 34
[ Fri Oct 11 21:51:58 2024 ] 	Mean test loss of 16 batches: 1.6389722973108292.
[ Fri Oct 11 21:51:58 2024 ] 	Top1: 54.75%
[ Fri Oct 11 21:51:58 2024 ] 	Top5: 87.00%
[ Fri Oct 11 21:51:58 2024 ] Training epoch: 35
[ Fri Oct 11 22:02:07 2024 ] 	Mean training loss: 1.6690.  Mean training acc: 54.64%.
[ Fri Oct 11 22:02:07 2024 ] 	Time consumption: [Data]02%, [Network]98%
[ Fri Oct 11 22:02:07 2024 ] Eval epoch: 35
[ Fri Oct 11 22:03:08 2024 ] 	Mean test loss of 16 batches: 1.4159096218645573.
[ Fri Oct 11 22:03:08 2024 ] 	Top1: 60.65%
[ Fri Oct 11 22:03:08 2024 ] 	Top5: 89.05%
[ Fri Oct 11 22:03:08 2024 ] Training epoch: 36
[ Fri Oct 11 22:13:11 2024 ] 	Mean training loss: 1.3015.  Mean training acc: 64.62%.
[ Fri Oct 11 22:13:11 2024 ] 	Time consumption: [Data]02%, [Network]98%
[ Fri Oct 11 22:13:11 2024 ] Eval epoch: 36
[ Fri Oct 11 22:14:13 2024 ] 	Mean test loss of 16 batches: 1.0718430206179619.
[ Fri Oct 11 22:14:13 2024 ] 	Top1: 69.50%
[ Fri Oct 11 22:14:13 2024 ] 	Top5: 92.30%
[ Fri Oct 11 22:14:13 2024 ] Training epoch: 37
[ Fri Oct 11 22:24:16 2024 ] 	Mean training loss: 1.1548.  Mean training acc: 68.93%.
[ Fri Oct 11 22:24:16 2024 ] 	Time consumption: [Data]02%, [Network]98%
[ Fri Oct 11 22:24:16 2024 ] Eval epoch: 37
[ Fri Oct 11 22:25:18 2024 ] 	Mean test loss of 16 batches: 1.0530853793025017.
[ Fri Oct 11 22:25:18 2024 ] 	Top1: 70.75%
[ Fri Oct 11 22:25:18 2024 ] 	Top5: 92.55%
[ Fri Oct 11 22:25:18 2024 ] Training epoch: 38
[ Fri Oct 11 22:35:24 2024 ] 	Mean training loss: 1.0958.  Mean training acc: 70.12%.
[ Fri Oct 11 22:35:24 2024 ] 	Time consumption: [Data]02%, [Network]98%
[ Fri Oct 11 22:35:24 2024 ] Eval epoch: 38
[ Fri Oct 11 22:36:27 2024 ] 	Mean test loss of 16 batches: 1.0547498129308224.
[ Fri Oct 11 22:36:27 2024 ] 	Top1: 70.15%
[ Fri Oct 11 22:36:27 2024 ] 	Top5: 92.80%
[ Fri Oct 11 22:36:27 2024 ] Training epoch: 39
[ Fri Oct 11 22:46:27 2024 ] 	Mean training loss: 1.0442.  Mean training acc: 71.69%.
[ Fri Oct 11 22:46:27 2024 ] 	Time consumption: [Data]02%, [Network]98%
[ Fri Oct 11 22:46:27 2024 ] Eval epoch: 39
[ Fri Oct 11 22:47:30 2024 ] 	Mean test loss of 16 batches: 1.0611372105777264.
[ Fri Oct 11 22:47:30 2024 ] 	Top1: 70.65%
[ Fri Oct 11 22:47:30 2024 ] 	Top5: 92.75%
[ Fri Oct 11 22:47:30 2024 ] Training epoch: 40
[ Fri Oct 11 22:57:30 2024 ] 	Mean training loss: 1.0060.  Mean training acc: 72.52%.
[ Fri Oct 11 22:57:30 2024 ] 	Time consumption: [Data]02%, [Network]98%
[ Fri Oct 11 22:57:30 2024 ] Eval epoch: 40
[ Fri Oct 11 22:58:33 2024 ] 	Mean test loss of 16 batches: 1.0833942648023367.
[ Fri Oct 11 22:58:33 2024 ] 	Top1: 70.20%
[ Fri Oct 11 22:58:33 2024 ] 	Top5: 93.05%
[ Fri Oct 11 22:58:33 2024 ] Training epoch: 41
[ Fri Oct 11 23:08:29 2024 ] 	Mean training loss: 0.9759.  Mean training acc: 73.51%.
[ Fri Oct 11 23:08:29 2024 ] 	Time consumption: [Data]02%, [Network]98%
[ Fri Oct 11 23:08:30 2024 ] Eval epoch: 41
[ Fri Oct 11 23:09:31 2024 ] 	Mean test loss of 16 batches: 1.0580315068364143.
[ Fri Oct 11 23:09:31 2024 ] 	Top1: 70.25%
[ Fri Oct 11 23:09:31 2024 ] 	Top5: 93.45%
[ Fri Oct 11 23:09:31 2024 ] Training epoch: 42
[ Fri Oct 11 23:19:30 2024 ] 	Mean training loss: 0.9410.  Mean training acc: 74.48%.
[ Fri Oct 11 23:19:30 2024 ] 	Time consumption: [Data]02%, [Network]98%
[ Fri Oct 11 23:19:30 2024 ] Eval epoch: 42
[ Fri Oct 11 23:20:34 2024 ] 	Mean test loss of 16 batches: 1.0584685392677784.
[ Fri Oct 11 23:20:34 2024 ] 	Top1: 69.90%
[ Fri Oct 11 23:20:34 2024 ] 	Top5: 93.35%
[ Fri Oct 11 23:20:34 2024 ] Training epoch: 43
[ Fri Oct 11 23:30:36 2024 ] 	Mean training loss: 0.9046.  Mean training acc: 75.45%.
[ Fri Oct 11 23:30:36 2024 ] 	Time consumption: [Data]02%, [Network]98%
[ Fri Oct 11 23:30:36 2024 ] Eval epoch: 43
[ Fri Oct 11 23:31:38 2024 ] 	Mean test loss of 16 batches: 1.1219256464391947.
[ Fri Oct 11 23:31:38 2024 ] 	Top1: 69.05%
[ Fri Oct 11 23:31:39 2024 ] 	Top5: 92.70%
[ Fri Oct 11 23:31:39 2024 ] Training epoch: 44
[ Fri Oct 11 23:41:48 2024 ] 	Mean training loss: 0.8837.  Mean training acc: 75.79%.
[ Fri Oct 11 23:41:48 2024 ] 	Time consumption: [Data]02%, [Network]98%
[ Fri Oct 11 23:41:48 2024 ] Eval epoch: 44
[ Fri Oct 11 23:42:51 2024 ] 	Mean test loss of 16 batches: 1.1191859878599644.
[ Fri Oct 11 23:42:51 2024 ] 	Top1: 69.60%
[ Fri Oct 11 23:42:51 2024 ] 	Top5: 92.65%
[ Fri Oct 11 23:42:51 2024 ] Training epoch: 45
[ Fri Oct 11 23:52:59 2024 ] 	Mean training loss: 0.8444.  Mean training acc: 77.09%.
[ Fri Oct 11 23:52:59 2024 ] 	Time consumption: [Data]02%, [Network]98%
[ Fri Oct 11 23:52:59 2024 ] Eval epoch: 45
[ Fri Oct 11 23:54:02 2024 ] 	Mean test loss of 16 batches: 1.1096274964511395.
[ Fri Oct 11 23:54:02 2024 ] 	Top1: 69.90%
[ Fri Oct 11 23:54:03 2024 ] 	Top5: 92.55%
[ Fri Oct 11 23:54:03 2024 ] Training epoch: 46
[ Sat Oct 12 00:04:11 2024 ] 	Mean training loss: 0.8153.  Mean training acc: 77.61%.
[ Sat Oct 12 00:04:11 2024 ] 	Time consumption: [Data]02%, [Network]98%
[ Sat Oct 12 00:04:12 2024 ] Eval epoch: 46
[ Sat Oct 12 00:05:14 2024 ] 	Mean test loss of 16 batches: 1.125306237488985.
[ Sat Oct 12 00:05:14 2024 ] 	Top1: 69.40%
[ Sat Oct 12 00:05:14 2024 ] 	Top5: 93.05%
[ Sat Oct 12 00:05:14 2024 ] Training epoch: 47
[ Sat Oct 12 00:15:16 2024 ] 	Mean training loss: 0.7931.  Mean training acc: 78.27%.
[ Sat Oct 12 00:15:16 2024 ] 	Time consumption: [Data]02%, [Network]98%
[ Sat Oct 12 00:15:16 2024 ] Eval epoch: 47
[ Sat Oct 12 00:16:18 2024 ] 	Mean test loss of 16 batches: 1.1689941696822643.
[ Sat Oct 12 00:16:18 2024 ] 	Top1: 68.70%
[ Sat Oct 12 00:16:18 2024 ] 	Top5: 92.80%
[ Sat Oct 12 00:16:18 2024 ] Training epoch: 48
[ Sat Oct 12 00:26:23 2024 ] 	Mean training loss: 0.7571.  Mean training acc: 79.35%.
[ Sat Oct 12 00:26:23 2024 ] 	Time consumption: [Data]02%, [Network]98%
[ Sat Oct 12 00:26:23 2024 ] Eval epoch: 48
[ Sat Oct 12 00:27:25 2024 ] 	Mean test loss of 16 batches: 1.1472180802375078.
[ Sat Oct 12 00:27:25 2024 ] 	Top1: 68.60%
[ Sat Oct 12 00:27:25 2024 ] 	Top5: 93.15%
[ Sat Oct 12 00:27:25 2024 ] Training epoch: 49
[ Sat Oct 12 00:37:27 2024 ] 	Mean training loss: 0.7406.  Mean training acc: 79.79%.
[ Sat Oct 12 00:37:27 2024 ] 	Time consumption: [Data]02%, [Network]98%
[ Sat Oct 12 00:37:27 2024 ] Eval epoch: 49
[ Sat Oct 12 00:38:29 2024 ] 	Mean test loss of 16 batches: 1.1708189137279987.
[ Sat Oct 12 00:38:29 2024 ] 	Top1: 69.10%
[ Sat Oct 12 00:38:29 2024 ] 	Top5: 92.30%
[ Sat Oct 12 00:38:29 2024 ] Training epoch: 50
[ Sat Oct 12 00:48:34 2024 ] 	Mean training loss: 0.7129.  Mean training acc: 80.08%.
[ Sat Oct 12 00:48:34 2024 ] 	Time consumption: [Data]02%, [Network]98%
[ Sat Oct 12 00:48:35 2024 ] Eval epoch: 50
[ Sat Oct 12 00:49:39 2024 ] 	Mean test loss of 16 batches: 1.1657188534736633.
[ Sat Oct 12 00:49:39 2024 ] 	Top1: 69.15%
[ Sat Oct 12 00:49:39 2024 ] 	Top5: 91.95%
[ Sat Oct 12 00:49:39 2024 ] Training epoch: 51
[ Sat Oct 12 00:59:38 2024 ] 	Mean training loss: 0.6880.  Mean training acc: 81.05%.
[ Sat Oct 12 00:59:38 2024 ] 	Time consumption: [Data]02%, [Network]98%
[ Sat Oct 12 00:59:38 2024 ] Eval epoch: 51
[ Sat Oct 12 01:00:42 2024 ] 	Mean test loss of 16 batches: 1.2025048360228539.
[ Sat Oct 12 01:00:42 2024 ] 	Top1: 67.55%
[ Sat Oct 12 01:00:42 2024 ] 	Top5: 91.70%
[ Sat Oct 12 01:00:42 2024 ] Training epoch: 52
[ Sat Oct 12 01:10:42 2024 ] 	Mean training loss: 0.6706.  Mean training acc: 81.39%.
[ Sat Oct 12 01:10:42 2024 ] 	Time consumption: [Data]02%, [Network]98%
[ Sat Oct 12 01:10:43 2024 ] Eval epoch: 52
[ Sat Oct 12 01:11:46 2024 ] 	Mean test loss of 16 batches: 1.1990553215146065.
[ Sat Oct 12 01:11:46 2024 ] 	Top1: 68.50%
[ Sat Oct 12 01:11:46 2024 ] 	Top5: 92.10%
[ Sat Oct 12 01:11:46 2024 ] Training epoch: 53
[ Sat Oct 12 01:21:46 2024 ] 	Mean training loss: 0.6560.  Mean training acc: 82.03%.
[ Sat Oct 12 01:21:46 2024 ] 	Time consumption: [Data]02%, [Network]98%
[ Sat Oct 12 01:21:47 2024 ] Eval epoch: 53
[ Sat Oct 12 01:22:50 2024 ] 	Mean test loss of 16 batches: 1.266718152910471.
[ Sat Oct 12 01:22:50 2024 ] 	Top1: 68.20%
[ Sat Oct 12 01:22:50 2024 ] 	Top5: 91.60%
[ Sat Oct 12 01:22:50 2024 ] Training epoch: 54
[ Sat Oct 12 01:32:50 2024 ] 	Mean training loss: 0.6287.  Mean training acc: 82.61%.
[ Sat Oct 12 01:32:50 2024 ] 	Time consumption: [Data]02%, [Network]98%
[ Sat Oct 12 01:32:50 2024 ] Eval epoch: 54
[ Sat Oct 12 01:33:52 2024 ] 	Mean test loss of 16 batches: 1.253096416592598.
[ Sat Oct 12 01:33:52 2024 ] 	Top1: 68.15%
[ Sat Oct 12 01:33:52 2024 ] 	Top5: 91.75%
[ Sat Oct 12 01:33:52 2024 ] Training epoch: 55
[ Sat Oct 12 01:43:57 2024 ] 	Mean training loss: 0.6221.  Mean training acc: 83.26%.
[ Sat Oct 12 01:43:57 2024 ] 	Time consumption: [Data]02%, [Network]98%
[ Sat Oct 12 01:43:58 2024 ] Eval epoch: 55
[ Sat Oct 12 01:44:59 2024 ] 	Mean test loss of 16 batches: 1.2600616477429867.
[ Sat Oct 12 01:44:59 2024 ] 	Top1: 67.95%
[ Sat Oct 12 01:44:59 2024 ] 	Top5: 91.95%
[ Sat Oct 12 01:44:59 2024 ] Training epoch: 56
[ Sat Oct 12 01:55:00 2024 ] 	Mean training loss: 0.4791.  Mean training acc: 87.68%.
[ Sat Oct 12 01:55:00 2024 ] 	Time consumption: [Data]02%, [Network]98%
[ Sat Oct 12 01:55:01 2024 ] Eval epoch: 56
[ Sat Oct 12 01:56:03 2024 ] 	Mean test loss of 16 batches: 1.1797076053917408.
[ Sat Oct 12 01:56:03 2024 ] 	Top1: 69.20%
[ Sat Oct 12 01:56:03 2024 ] 	Top5: 91.90%
[ Sat Oct 12 01:56:03 2024 ] Training epoch: 57
[ Sat Oct 12 02:06:01 2024 ] 	Mean training loss: 0.4196.  Mean training acc: 89.56%.
[ Sat Oct 12 02:06:01 2024 ] 	Time consumption: [Data]02%, [Network]98%
[ Sat Oct 12 02:06:01 2024 ] Eval epoch: 57
[ Sat Oct 12 02:07:01 2024 ] 	Mean test loss of 16 batches: 1.1853369623422623.
[ Sat Oct 12 02:07:01 2024 ] 	Top1: 69.35%
[ Sat Oct 12 02:07:01 2024 ] 	Top5: 92.15%
[ Sat Oct 12 02:07:01 2024 ] Training epoch: 58
[ Sat Oct 12 02:17:02 2024 ] 	Mean training loss: 0.4028.  Mean training acc: 90.35%.
[ Sat Oct 12 02:17:02 2024 ] 	Time consumption: [Data]02%, [Network]98%
[ Sat Oct 12 02:17:02 2024 ] Eval epoch: 58
[ Sat Oct 12 02:18:06 2024 ] 	Mean test loss of 16 batches: 1.178924836218357.
[ Sat Oct 12 02:18:06 2024 ] 	Top1: 69.35%
[ Sat Oct 12 02:18:06 2024 ] 	Top5: 92.55%
[ Sat Oct 12 02:18:06 2024 ] Training epoch: 59
[ Sat Oct 12 02:28:10 2024 ] 	Mean training loss: 0.3820.  Mean training acc: 90.86%.
[ Sat Oct 12 02:28:10 2024 ] 	Time consumption: [Data]02%, [Network]98%
[ Sat Oct 12 02:28:10 2024 ] Eval epoch: 59
[ Sat Oct 12 02:29:12 2024 ] 	Mean test loss of 16 batches: 1.1669495720416307.
[ Sat Oct 12 02:29:12 2024 ] 	Top1: 69.75%
[ Sat Oct 12 02:29:12 2024 ] 	Top5: 92.50%
[ Sat Oct 12 02:29:13 2024 ] Training epoch: 60
[ Sat Oct 12 02:39:16 2024 ] 	Mean training loss: 0.3759.  Mean training acc: 90.97%.
[ Sat Oct 12 02:39:16 2024 ] 	Time consumption: [Data]02%, [Network]98%
[ Sat Oct 12 02:39:17 2024 ] Eval epoch: 60
[ Sat Oct 12 02:40:18 2024 ] 	Mean test loss of 16 batches: 1.1647628955543041.
[ Sat Oct 12 02:40:18 2024 ] 	Top1: 69.80%
[ Sat Oct 12 02:40:18 2024 ] 	Top5: 92.60%
[ Sat Oct 12 02:40:18 2024 ] Training epoch: 61
[ Sat Oct 12 02:50:20 2024 ] 	Mean training loss: 0.3654.  Mean training acc: 91.26%.
[ Sat Oct 12 02:50:20 2024 ] 	Time consumption: [Data]02%, [Network]98%
[ Sat Oct 12 02:50:20 2024 ] Eval epoch: 61
[ Sat Oct 12 02:51:22 2024 ] 	Mean test loss of 16 batches: 1.1754964143037796.
[ Sat Oct 12 02:51:22 2024 ] 	Top1: 69.95%
[ Sat Oct 12 02:51:22 2024 ] 	Top5: 92.75%
[ Sat Oct 12 02:51:23 2024 ] Training epoch: 62
[ Sat Oct 12 03:01:20 2024 ] 	Mean training loss: 0.3528.  Mean training acc: 91.69%.
[ Sat Oct 12 03:01:20 2024 ] 	Time consumption: [Data]02%, [Network]98%
[ Sat Oct 12 03:01:20 2024 ] Eval epoch: 62
[ Sat Oct 12 03:02:22 2024 ] 	Mean test loss of 16 batches: 1.1905651986598969.
[ Sat Oct 12 03:02:22 2024 ] 	Top1: 69.40%
[ Sat Oct 12 03:02:22 2024 ] 	Top5: 92.60%
[ Sat Oct 12 03:02:22 2024 ] Training epoch: 63
[ Sat Oct 12 03:12:26 2024 ] 	Mean training loss: 0.3430.  Mean training acc: 91.84%.
[ Sat Oct 12 03:12:26 2024 ] 	Time consumption: [Data]02%, [Network]98%
[ Sat Oct 12 03:12:26 2024 ] Eval epoch: 63
[ Sat Oct 12 03:13:28 2024 ] 	Mean test loss of 16 batches: 1.1819243244826794.
[ Sat Oct 12 03:13:28 2024 ] 	Top1: 69.90%
[ Sat Oct 12 03:13:28 2024 ] 	Top5: 92.20%
[ Sat Oct 12 03:13:28 2024 ] Training epoch: 64
[ Sat Oct 12 03:23:27 2024 ] 	Mean training loss: 0.3301.  Mean training acc: 92.24%.
[ Sat Oct 12 03:23:27 2024 ] 	Time consumption: [Data]02%, [Network]98%
[ Sat Oct 12 03:23:27 2024 ] Eval epoch: 64
[ Sat Oct 12 03:24:30 2024 ] 	Mean test loss of 16 batches: 1.1995928101241589.
[ Sat Oct 12 03:24:30 2024 ] 	Top1: 69.40%
[ Sat Oct 12 03:24:30 2024 ] 	Top5: 92.10%
[ Sat Oct 12 03:24:30 2024 ] Training epoch: 65
[ Sat Oct 12 03:34:33 2024 ] 	Mean training loss: 0.3310.  Mean training acc: 92.32%.
[ Sat Oct 12 03:34:33 2024 ] 	Time consumption: [Data]02%, [Network]98%
[ Sat Oct 12 03:34:33 2024 ] Eval epoch: 65
[ Sat Oct 12 03:35:34 2024 ] 	Mean test loss of 16 batches: 1.190175335854292.
[ Sat Oct 12 03:35:34 2024 ] 	Top1: 70.30%
[ Sat Oct 12 03:35:34 2024 ] 	Top5: 92.10%
[ Sat Oct 12 03:36:36 2024 ] Best accuracy: 0.7075
[ Sat Oct 12 03:36:36 2024 ] Epoch number: 37
[ Sat Oct 12 03:36:36 2024 ] Model name: ./work_dir/uav/ctrgcn_bone_v2
[ Sat Oct 12 03:36:36 2024 ] Model total number of params: 1460911
[ Sat Oct 12 03:36:36 2024 ] Weight decay: 0.0004
[ Sat Oct 12 03:36:36 2024 ] Base LR: 0.1
[ Sat Oct 12 03:36:36 2024 ] Batch Size: 64
[ Sat Oct 12 03:36:36 2024 ] Test Batch Size: 128
[ Sat Oct 12 03:36:36 2024 ] seed: 1
[ Sun Oct 13 12:20:54 2024 ] Load weights from E:\Desktop\10-11-MS-CTR-GCN\work_dir\uav\ctrgcn_bone_v2\runs-37-9472.pt.
[ Sun Oct 13 12:20:56 2024 ] using warm up, epoch: 5
[ Sun Oct 13 17:39:26 2024 ] Load weights from E:\Desktop\≤‚ ‘\SNC-CTR-GCN\work_dir\uav\ctrgcn_bone_v2\runs-37-9472.pt.
[ Sun Oct 13 17:39:27 2024 ] using warm up, epoch: 5
[ Mon Oct 14 22:42:39 2024 ] Load weights from E:\Desktop\≤‚ ‘\SNC-CTR-GCN\work_dir\uav\ctrgcn_bone_v2\runs-37-9472.pt.
[ Mon Oct 14 22:42:40 2024 ] using warm up, epoch: 5
[ Wed Oct 16 12:31:43 2024 ] Load weights from E:\Desktop\≤‚ ‘\SNC-CTR-GCN\work_dir\uav\ctrgcn_bone_v2\runs-65-16640.pt.
[ Wed Oct 16 12:31:45 2024 ] using warm up, epoch: 5
