[ Sat Oct 12 16:22:43 2024 ] using warm up, epoch: 5
[ Sat Oct 12 16:22:51 2024 ] Parameters:
{'work_dir': './work_dir/uav/ctrgcn_motion_SNC_v2', 'model_saved_name': './work_dir/uav/ctrgcn_motion_SNC_v2/runs', 'config': 'config/uav/motion_SNC.yaml', 'phase': 'train', 'save_score': False, 'seed': 1, 'log_interval': 100, 'save_interval': 1, 'save_epoch': 30, 'eval_interval': 5, 'print_log': True, 'show_topk': [1, 5], 'feeder': 'feeders.feeder_uav_strong_noise.Feeder', 'num_worker': 8, 'train_feeder_args': {'data_path': 'data/uav/v2/train_joint.npy', 'label_path': 'data/uav/v2/train_label.npy', 'debug': False, 'random_choose': False, 'random_shift': False, 'random_move': False, 'window_size': 120, 'normalization': True, 'random_rot': True, 'p_interval': [0.5, 1], 'vel': True, 'bone': False}, 'test_feeder_args': {'data_path': 'data/uav/v2/test_joint_A.npy', 'label_path': 'data/uav/v2/test_label_A.npy', 'window_size': 120, 'p_interval': [0.95], 'vel': True, 'bone': False, 'debug': False, 'normalization': True}, 'model': 'model.ctrgcn.Model', 'model_args': {'num_class': 155, 'num_point': 17, 'num_person': 2, 'graph': 'graph.uav_human.Graph', 'graph_args': {'labeling_mode': 'spatial'}}, 'weights': None, 'ignore_weights': [], 'base_lr': 0.1, 'min_lr': 0.0001, 'step': [35, 55], 'device': [1], 'optimizer': 'SGD', 'nesterov': True, 'batch_size': 64, 'test_batch_size': 128, 'start_epoch': 0, 'num_epoch': 65, 'weight_decay': 0.0004, 'lr_decay_rate': 0.1, 'warm_up_epoch': 5}

[ Sat Oct 12 16:22:51 2024 ] # Parameters: 1460911
[ Sat Oct 12 16:22:51 2024 ] Training epoch: 1
[ Sat Oct 12 16:32:14 2024 ] 	Mean training loss: 4.9949.  Mean training acc: 1.37%.
[ Sat Oct 12 16:32:14 2024 ] 	Time consumption: [Data]01%, [Network]99%
[ Sat Oct 12 16:32:14 2024 ] Eval epoch: 1
[ Sat Oct 12 16:33:11 2024 ] 	Mean test loss of 16 batches: 4.669511616230011.
[ Sat Oct 12 16:33:11 2024 ] 	Top1: 2.45%
[ Sat Oct 12 16:33:11 2024 ] 	Top5: 10.10%
[ Sat Oct 12 16:33:11 2024 ] Training epoch: 2
[ Sat Oct 12 16:42:30 2024 ] 	Mean training loss: 4.7270.  Mean training acc: 2.02%.
[ Sat Oct 12 16:42:30 2024 ] 	Time consumption: [Data]01%, [Network]99%
[ Sat Oct 12 16:42:30 2024 ] Eval epoch: 2
[ Sat Oct 12 16:43:27 2024 ] 	Mean test loss of 16 batches: 4.529442727565765.
[ Sat Oct 12 16:43:27 2024 ] 	Top1: 2.35%
[ Sat Oct 12 16:43:27 2024 ] 	Top5: 12.00%
[ Sat Oct 12 16:43:27 2024 ] Training epoch: 3
[ Sat Oct 12 16:52:45 2024 ] 	Mean training loss: 4.5367.  Mean training acc: 2.67%.
[ Sat Oct 12 16:52:45 2024 ] 	Time consumption: [Data]01%, [Network]99%
[ Sat Oct 12 16:52:45 2024 ] Eval epoch: 3
[ Sat Oct 12 16:53:42 2024 ] 	Mean test loss of 16 batches: 4.307274475693703.
[ Sat Oct 12 16:53:42 2024 ] 	Top1: 3.65%
[ Sat Oct 12 16:53:42 2024 ] 	Top5: 16.90%
[ Sat Oct 12 16:53:42 2024 ] Training epoch: 4
[ Sat Oct 12 17:03:02 2024 ] 	Mean training loss: 4.3810.  Mean training acc: 3.45%.
[ Sat Oct 12 17:03:02 2024 ] 	Time consumption: [Data]01%, [Network]99%
[ Sat Oct 12 17:03:02 2024 ] Eval epoch: 4
[ Sat Oct 12 17:03:59 2024 ] 	Mean test loss of 16 batches: 4.314581885933876.
[ Sat Oct 12 17:03:59 2024 ] 	Top1: 3.40%
[ Sat Oct 12 17:03:59 2024 ] 	Top5: 16.30%
[ Sat Oct 12 17:03:59 2024 ] Training epoch: 5
[ Sat Oct 12 17:13:19 2024 ] 	Mean training loss: 4.1976.  Mean training acc: 4.77%.
[ Sat Oct 12 17:13:19 2024 ] 	Time consumption: [Data]01%, [Network]99%
[ Sat Oct 12 17:13:19 2024 ] Eval epoch: 5
[ Sat Oct 12 17:14:16 2024 ] 	Mean test loss of 16 batches: 4.177237764000893.
[ Sat Oct 12 17:14:16 2024 ] 	Top1: 4.95%
[ Sat Oct 12 17:14:16 2024 ] 	Top5: 21.85%
[ Sat Oct 12 17:14:16 2024 ] Training epoch: 6
[ Sat Oct 12 17:23:35 2024 ] 	Mean training loss: 3.8614.  Mean training acc: 8.24%.
[ Sat Oct 12 17:23:35 2024 ] 	Time consumption: [Data]01%, [Network]99%
[ Sat Oct 12 17:23:35 2024 ] Eval epoch: 6
[ Sat Oct 12 17:24:33 2024 ] 	Mean test loss of 16 batches: 3.468150720000267.
[ Sat Oct 12 17:24:33 2024 ] 	Top1: 12.45%
[ Sat Oct 12 17:24:33 2024 ] 	Top5: 40.35%
[ Sat Oct 12 17:24:33 2024 ] Training epoch: 7
[ Sat Oct 12 17:33:54 2024 ] 	Mean training loss: 3.6161.  Mean training acc: 11.83%.
[ Sat Oct 12 17:33:54 2024 ] 	Time consumption: [Data]01%, [Network]99%
[ Sat Oct 12 17:33:54 2024 ] Eval epoch: 7
[ Sat Oct 12 17:34:51 2024 ] 	Mean test loss of 16 batches: 3.4943266808986664.
[ Sat Oct 12 17:34:51 2024 ] 	Top1: 12.45%
[ Sat Oct 12 17:34:51 2024 ] 	Top5: 39.30%
[ Sat Oct 12 17:34:51 2024 ] Training epoch: 8
[ Sat Oct 12 17:44:11 2024 ] 	Mean training loss: 3.4286.  Mean training acc: 15.02%.
[ Sat Oct 12 17:44:11 2024 ] 	Time consumption: [Data]01%, [Network]99%
[ Sat Oct 12 17:44:11 2024 ] Eval epoch: 8
[ Sat Oct 12 17:45:07 2024 ] 	Mean test loss of 16 batches: 3.1513487696647644.
[ Sat Oct 12 17:45:07 2024 ] 	Top1: 18.90%
[ Sat Oct 12 17:45:07 2024 ] 	Top5: 51.70%
[ Sat Oct 12 17:45:07 2024 ] Training epoch: 9
[ Sat Oct 12 17:54:26 2024 ] 	Mean training loss: 3.2656.  Mean training acc: 18.10%.
[ Sat Oct 12 17:54:26 2024 ] 	Time consumption: [Data]01%, [Network]99%
[ Sat Oct 12 17:54:26 2024 ] Eval epoch: 9
[ Sat Oct 12 17:55:23 2024 ] 	Mean test loss of 16 batches: 2.9335339218378067.
[ Sat Oct 12 17:55:23 2024 ] 	Top1: 21.95%
[ Sat Oct 12 17:55:23 2024 ] 	Top5: 59.60%
[ Sat Oct 12 17:55:23 2024 ] Training epoch: 10
[ Sat Oct 12 18:04:42 2024 ] 	Mean training loss: 3.1677.  Mean training acc: 20.10%.
[ Sat Oct 12 18:04:42 2024 ] 	Time consumption: [Data]01%, [Network]99%
[ Sat Oct 12 18:04:42 2024 ] Eval epoch: 10
[ Sat Oct 12 18:05:39 2024 ] 	Mean test loss of 16 batches: 2.7471425235271454.
[ Sat Oct 12 18:05:39 2024 ] 	Top1: 27.10%
[ Sat Oct 12 18:05:39 2024 ] 	Top5: 62.55%
[ Sat Oct 12 18:05:39 2024 ] Training epoch: 11
[ Sat Oct 12 18:14:58 2024 ] 	Mean training loss: 3.0592.  Mean training acc: 22.52%.
[ Sat Oct 12 18:14:58 2024 ] 	Time consumption: [Data]01%, [Network]99%
[ Sat Oct 12 18:14:58 2024 ] Eval epoch: 11
[ Sat Oct 12 18:15:55 2024 ] 	Mean test loss of 16 batches: 3.1031752824783325.
[ Sat Oct 12 18:15:55 2024 ] 	Top1: 21.75%
[ Sat Oct 12 18:15:55 2024 ] 	Top5: 54.05%
[ Sat Oct 12 18:15:55 2024 ] Training epoch: 12
[ Sat Oct 12 18:25:14 2024 ] 	Mean training loss: 2.9720.  Mean training acc: 24.34%.
[ Sat Oct 12 18:25:14 2024 ] 	Time consumption: [Data]01%, [Network]99%
[ Sat Oct 12 18:25:14 2024 ] Eval epoch: 12
[ Sat Oct 12 18:26:06 2024 ] 	Mean test loss of 16 batches: 2.6206238493323326.
[ Sat Oct 12 18:26:06 2024 ] 	Top1: 29.55%
[ Sat Oct 12 18:26:06 2024 ] 	Top5: 67.20%
[ Sat Oct 12 18:26:06 2024 ] Training epoch: 13
[ Sat Oct 12 18:35:24 2024 ] 	Mean training loss: 2.9236.  Mean training acc: 26.01%.
[ Sat Oct 12 18:35:24 2024 ] 	Time consumption: [Data]01%, [Network]99%
[ Sat Oct 12 18:35:24 2024 ] Eval epoch: 13
[ Sat Oct 12 18:36:22 2024 ] 	Mean test loss of 16 batches: 2.4523023664951324.
[ Sat Oct 12 18:36:22 2024 ] 	Top1: 33.35%
[ Sat Oct 12 18:36:22 2024 ] 	Top5: 69.10%
[ Sat Oct 12 18:36:22 2024 ] Training epoch: 14
[ Sat Oct 12 18:45:39 2024 ] 	Mean training loss: 2.8615.  Mean training acc: 27.06%.
[ Sat Oct 12 18:45:39 2024 ] 	Time consumption: [Data]01%, [Network]99%
[ Sat Oct 12 18:45:39 2024 ] Eval epoch: 14
[ Sat Oct 12 18:46:37 2024 ] 	Mean test loss of 16 batches: 2.6380368769168854.
[ Sat Oct 12 18:46:37 2024 ] 	Top1: 32.40%
[ Sat Oct 12 18:46:37 2024 ] 	Top5: 66.55%
[ Sat Oct 12 18:46:37 2024 ] Training epoch: 15
[ Sat Oct 12 18:55:54 2024 ] 	Mean training loss: 2.8079.  Mean training acc: 28.29%.
[ Sat Oct 12 18:55:54 2024 ] 	Time consumption: [Data]01%, [Network]99%
[ Sat Oct 12 18:55:54 2024 ] Eval epoch: 15
[ Sat Oct 12 18:56:51 2024 ] 	Mean test loss of 16 batches: 2.3431511744856834.
[ Sat Oct 12 18:56:51 2024 ] 	Top1: 35.40%
[ Sat Oct 12 18:56:51 2024 ] 	Top5: 70.75%
[ Sat Oct 12 18:56:51 2024 ] Training epoch: 16
[ Sat Oct 12 19:06:10 2024 ] 	Mean training loss: 2.7598.  Mean training acc: 29.48%.
[ Sat Oct 12 19:06:10 2024 ] 	Time consumption: [Data]01%, [Network]99%
[ Sat Oct 12 19:06:10 2024 ] Eval epoch: 16
[ Sat Oct 12 19:07:07 2024 ] 	Mean test loss of 16 batches: 2.345259875059128.
[ Sat Oct 12 19:07:07 2024 ] 	Top1: 37.25%
[ Sat Oct 12 19:07:07 2024 ] 	Top5: 70.30%
[ Sat Oct 12 19:07:07 2024 ] Training epoch: 17
[ Sat Oct 12 19:16:27 2024 ] 	Mean training loss: 2.7190.  Mean training acc: 30.44%.
[ Sat Oct 12 19:16:27 2024 ] 	Time consumption: [Data]01%, [Network]99%
[ Sat Oct 12 19:16:27 2024 ] Eval epoch: 17
[ Sat Oct 12 19:17:24 2024 ] 	Mean test loss of 16 batches: 2.546127364039421.
[ Sat Oct 12 19:17:24 2024 ] 	Top1: 34.40%
[ Sat Oct 12 19:17:24 2024 ] 	Top5: 66.35%
[ Sat Oct 12 19:17:24 2024 ] Training epoch: 18
[ Sat Oct 12 19:26:41 2024 ] 	Mean training loss: 2.6862.  Mean training acc: 31.11%.
[ Sat Oct 12 19:26:41 2024 ] 	Time consumption: [Data]01%, [Network]99%
[ Sat Oct 12 19:26:41 2024 ] Eval epoch: 18
[ Sat Oct 12 19:27:38 2024 ] 	Mean test loss of 16 batches: 2.3807402849197388.
[ Sat Oct 12 19:27:38 2024 ] 	Top1: 35.70%
[ Sat Oct 12 19:27:38 2024 ] 	Top5: 71.50%
[ Sat Oct 12 19:27:38 2024 ] Training epoch: 19
[ Sat Oct 12 19:36:56 2024 ] 	Mean training loss: 2.6450.  Mean training acc: 31.84%.
[ Sat Oct 12 19:36:56 2024 ] 	Time consumption: [Data]01%, [Network]99%
[ Sat Oct 12 19:36:56 2024 ] Eval epoch: 19
[ Sat Oct 12 19:37:53 2024 ] 	Mean test loss of 16 batches: 2.309952676296234.
[ Sat Oct 12 19:37:53 2024 ] 	Top1: 37.50%
[ Sat Oct 12 19:37:53 2024 ] 	Top5: 73.00%
[ Sat Oct 12 19:37:53 2024 ] Training epoch: 20
[ Sat Oct 12 19:47:14 2024 ] 	Mean training loss: 2.6066.  Mean training acc: 32.67%.
[ Sat Oct 12 19:47:14 2024 ] 	Time consumption: [Data]01%, [Network]99%
[ Sat Oct 12 19:47:14 2024 ] Eval epoch: 20
[ Sat Oct 12 19:48:11 2024 ] 	Mean test loss of 16 batches: 2.2654031962156296.
[ Sat Oct 12 19:48:11 2024 ] 	Top1: 38.80%
[ Sat Oct 12 19:48:11 2024 ] 	Top5: 73.85%
[ Sat Oct 12 19:48:11 2024 ] Training epoch: 21
[ Sat Oct 12 19:57:27 2024 ] 	Mean training loss: 2.5859.  Mean training acc: 33.45%.
[ Sat Oct 12 19:57:27 2024 ] 	Time consumption: [Data]01%, [Network]99%
[ Sat Oct 12 19:57:27 2024 ] Eval epoch: 21
[ Sat Oct 12 19:58:25 2024 ] 	Mean test loss of 16 batches: 2.21721313893795.
[ Sat Oct 12 19:58:25 2024 ] 	Top1: 40.80%
[ Sat Oct 12 19:58:25 2024 ] 	Top5: 75.40%
[ Sat Oct 12 19:58:25 2024 ] Training epoch: 22
[ Sat Oct 12 20:07:40 2024 ] 	Mean training loss: 2.5436.  Mean training acc: 34.20%.
[ Sat Oct 12 20:07:40 2024 ] 	Time consumption: [Data]01%, [Network]99%
[ Sat Oct 12 20:07:40 2024 ] Eval epoch: 22
[ Sat Oct 12 20:08:37 2024 ] 	Mean test loss of 16 batches: 2.211451806128025.
[ Sat Oct 12 20:08:37 2024 ] 	Top1: 40.75%
[ Sat Oct 12 20:08:37 2024 ] 	Top5: 74.45%
[ Sat Oct 12 20:08:37 2024 ] Training epoch: 23
[ Sat Oct 12 20:17:53 2024 ] 	Mean training loss: 2.5268.  Mean training acc: 34.52%.
[ Sat Oct 12 20:17:53 2024 ] 	Time consumption: [Data]01%, [Network]99%
[ Sat Oct 12 20:17:53 2024 ] Eval epoch: 23
[ Sat Oct 12 20:18:50 2024 ] 	Mean test loss of 16 batches: 2.2390060052275658.
[ Sat Oct 12 20:18:50 2024 ] 	Top1: 39.15%
[ Sat Oct 12 20:18:50 2024 ] 	Top5: 71.85%
[ Sat Oct 12 20:18:50 2024 ] Training epoch: 24
[ Sat Oct 12 20:28:06 2024 ] 	Mean training loss: 2.5047.  Mean training acc: 35.44%.
[ Sat Oct 12 20:28:06 2024 ] 	Time consumption: [Data]01%, [Network]99%
[ Sat Oct 12 20:28:06 2024 ] Eval epoch: 24
[ Sat Oct 12 20:29:03 2024 ] 	Mean test loss of 16 batches: 2.202483259141445.
[ Sat Oct 12 20:29:03 2024 ] 	Top1: 41.95%
[ Sat Oct 12 20:29:03 2024 ] 	Top5: 75.10%
[ Sat Oct 12 20:29:03 2024 ] Training epoch: 25
[ Sat Oct 12 20:38:18 2024 ] 	Mean training loss: 2.4724.  Mean training acc: 36.00%.
[ Sat Oct 12 20:38:18 2024 ] 	Time consumption: [Data]01%, [Network]99%
[ Sat Oct 12 20:38:19 2024 ] Eval epoch: 25
[ Sat Oct 12 20:39:16 2024 ] 	Mean test loss of 16 batches: 2.338276542723179.
[ Sat Oct 12 20:39:16 2024 ] 	Top1: 38.90%
[ Sat Oct 12 20:39:16 2024 ] 	Top5: 73.00%
[ Sat Oct 12 20:39:16 2024 ] Training epoch: 26
[ Sat Oct 12 20:48:32 2024 ] 	Mean training loss: 2.4518.  Mean training acc: 36.48%.
[ Sat Oct 12 20:48:32 2024 ] 	Time consumption: [Data]01%, [Network]99%
[ Sat Oct 12 20:48:32 2024 ] Eval epoch: 26
[ Sat Oct 12 20:49:30 2024 ] 	Mean test loss of 16 batches: 2.2658641189336777.
[ Sat Oct 12 20:49:30 2024 ] 	Top1: 38.55%
[ Sat Oct 12 20:49:30 2024 ] 	Top5: 74.05%
[ Sat Oct 12 20:49:30 2024 ] Training epoch: 27
[ Sat Oct 12 20:58:54 2024 ] 	Mean training loss: 2.4316.  Mean training acc: 36.81%.
[ Sat Oct 12 20:58:54 2024 ] 	Time consumption: [Data]01%, [Network]99%
[ Sat Oct 12 20:58:54 2024 ] Eval epoch: 27
[ Sat Oct 12 20:59:51 2024 ] 	Mean test loss of 16 batches: 2.409676305949688.
[ Sat Oct 12 20:59:51 2024 ] 	Top1: 38.25%
[ Sat Oct 12 20:59:52 2024 ] 	Top5: 72.90%
[ Sat Oct 12 20:59:52 2024 ] Training epoch: 28
[ Sat Oct 12 21:09:08 2024 ] 	Mean training loss: 2.4139.  Mean training acc: 37.57%.
[ Sat Oct 12 21:09:08 2024 ] 	Time consumption: [Data]01%, [Network]99%
[ Sat Oct 12 21:09:08 2024 ] Eval epoch: 28
[ Sat Oct 12 21:10:05 2024 ] 	Mean test loss of 16 batches: 2.1289074644446373.
[ Sat Oct 12 21:10:05 2024 ] 	Top1: 42.65%
[ Sat Oct 12 21:10:05 2024 ] 	Top5: 76.35%
[ Sat Oct 12 21:10:05 2024 ] Training epoch: 29
[ Sat Oct 12 21:19:23 2024 ] 	Mean training loss: 2.3855.  Mean training acc: 38.01%.
[ Sat Oct 12 21:19:23 2024 ] 	Time consumption: [Data]01%, [Network]99%
[ Sat Oct 12 21:19:23 2024 ] Eval epoch: 29
[ Sat Oct 12 21:20:20 2024 ] 	Mean test loss of 16 batches: 2.228993684053421.
[ Sat Oct 12 21:20:20 2024 ] 	Top1: 42.00%
[ Sat Oct 12 21:20:20 2024 ] 	Top5: 74.00%
[ Sat Oct 12 21:20:20 2024 ] Training epoch: 30
[ Sat Oct 12 21:29:40 2024 ] 	Mean training loss: 2.3709.  Mean training acc: 38.33%.
[ Sat Oct 12 21:29:40 2024 ] 	Time consumption: [Data]01%, [Network]99%
[ Sat Oct 12 21:29:40 2024 ] Eval epoch: 30
[ Sat Oct 12 21:30:39 2024 ] 	Mean test loss of 16 batches: 2.0720150619745255.
[ Sat Oct 12 21:30:39 2024 ] 	Top1: 43.75%
[ Sat Oct 12 21:30:39 2024 ] 	Top5: 77.05%
[ Sat Oct 12 21:30:39 2024 ] Training epoch: 31
[ Sat Oct 12 21:39:58 2024 ] 	Mean training loss: 2.3516.  Mean training acc: 39.02%.
[ Sat Oct 12 21:39:58 2024 ] 	Time consumption: [Data]01%, [Network]99%
[ Sat Oct 12 21:39:58 2024 ] Eval epoch: 31
[ Sat Oct 12 21:40:57 2024 ] 	Mean test loss of 16 batches: 2.099720038473606.
[ Sat Oct 12 21:40:57 2024 ] 	Top1: 42.80%
[ Sat Oct 12 21:40:57 2024 ] 	Top5: 75.70%
[ Sat Oct 12 21:40:57 2024 ] Training epoch: 32
[ Sat Oct 12 21:50:14 2024 ] 	Mean training loss: 2.3309.  Mean training acc: 39.60%.
[ Sat Oct 12 21:50:14 2024 ] 	Time consumption: [Data]01%, [Network]99%
[ Sat Oct 12 21:50:15 2024 ] Eval epoch: 32
[ Sat Oct 12 21:51:09 2024 ] 	Mean test loss of 16 batches: 2.18137875944376.
[ Sat Oct 12 21:51:09 2024 ] 	Top1: 41.50%
[ Sat Oct 12 21:51:09 2024 ] 	Top5: 76.40%
[ Sat Oct 12 21:51:09 2024 ] Training epoch: 33
[ Sat Oct 12 22:00:25 2024 ] 	Mean training loss: 2.3211.  Mean training acc: 40.03%.
[ Sat Oct 12 22:00:25 2024 ] 	Time consumption: [Data]01%, [Network]99%
[ Sat Oct 12 22:00:25 2024 ] Eval epoch: 33
[ Sat Oct 12 22:01:24 2024 ] 	Mean test loss of 16 batches: 2.1101366579532623.
[ Sat Oct 12 22:01:24 2024 ] 	Top1: 44.60%
[ Sat Oct 12 22:01:24 2024 ] 	Top5: 76.45%
[ Sat Oct 12 22:01:24 2024 ] Training epoch: 34
[ Sat Oct 12 22:10:43 2024 ] 	Mean training loss: 2.2950.  Mean training acc: 40.81%.
[ Sat Oct 12 22:10:43 2024 ] 	Time consumption: [Data]01%, [Network]99%
[ Sat Oct 12 22:10:43 2024 ] Eval epoch: 34
[ Sat Oct 12 22:11:40 2024 ] 	Mean test loss of 16 batches: 2.170325882732868.
[ Sat Oct 12 22:11:40 2024 ] 	Top1: 42.50%
[ Sat Oct 12 22:11:40 2024 ] 	Top5: 75.30%
[ Sat Oct 12 22:11:40 2024 ] Training epoch: 35
[ Sat Oct 12 22:20:58 2024 ] 	Mean training loss: 2.2772.  Mean training acc: 40.88%.
[ Sat Oct 12 22:20:58 2024 ] 	Time consumption: [Data]01%, [Network]99%
[ Sat Oct 12 22:20:58 2024 ] Eval epoch: 35
[ Sat Oct 12 22:21:55 2024 ] 	Mean test loss of 16 batches: 2.0183863267302513.
[ Sat Oct 12 22:21:55 2024 ] 	Top1: 45.80%
[ Sat Oct 12 22:21:55 2024 ] 	Top5: 78.35%
[ Sat Oct 12 22:21:55 2024 ] Training epoch: 36
[ Sat Oct 12 22:31:12 2024 ] 	Mean training loss: 1.9085.  Mean training acc: 50.28%.
[ Sat Oct 12 22:31:12 2024 ] 	Time consumption: [Data]01%, [Network]99%
[ Sat Oct 12 22:31:12 2024 ] Eval epoch: 36
[ Sat Oct 12 22:32:09 2024 ] 	Mean test loss of 16 batches: 1.516219224780798.
[ Sat Oct 12 22:32:09 2024 ] 	Top1: 56.70%
[ Sat Oct 12 22:32:09 2024 ] 	Top5: 85.65%
[ Sat Oct 12 22:32:09 2024 ] Training epoch: 37
[ Sat Oct 12 22:41:28 2024 ] 	Mean training loss: 1.7695.  Mean training acc: 54.08%.
[ Sat Oct 12 22:41:28 2024 ] 	Time consumption: [Data]01%, [Network]99%
[ Sat Oct 12 22:41:28 2024 ] Eval epoch: 37
[ Sat Oct 12 22:42:25 2024 ] 	Mean test loss of 16 batches: 1.4842703007161617.
[ Sat Oct 12 22:42:25 2024 ] 	Top1: 58.75%
[ Sat Oct 12 22:42:25 2024 ] 	Top5: 86.15%
[ Sat Oct 12 22:42:26 2024 ] Training epoch: 38
[ Sat Oct 12 22:51:47 2024 ] 	Mean training loss: 1.7111.  Mean training acc: 55.36%.
[ Sat Oct 12 22:51:47 2024 ] 	Time consumption: [Data]01%, [Network]99%
[ Sat Oct 12 22:51:47 2024 ] Eval epoch: 38
[ Sat Oct 12 22:52:44 2024 ] 	Mean test loss of 16 batches: 1.464079488068819.
[ Sat Oct 12 22:52:44 2024 ] 	Top1: 59.25%
[ Sat Oct 12 22:52:44 2024 ] 	Top5: 87.05%
[ Sat Oct 12 22:52:44 2024 ] Training epoch: 39
[ Sat Oct 12 23:02:03 2024 ] 	Mean training loss: 1.6703.  Mean training acc: 55.98%.
[ Sat Oct 12 23:02:03 2024 ] 	Time consumption: [Data]01%, [Network]99%
[ Sat Oct 12 23:02:03 2024 ] Eval epoch: 39
[ Sat Oct 12 23:03:01 2024 ] 	Mean test loss of 16 batches: 1.4800529666244984.
[ Sat Oct 12 23:03:01 2024 ] 	Top1: 59.60%
[ Sat Oct 12 23:03:01 2024 ] 	Top5: 86.45%
[ Sat Oct 12 23:03:01 2024 ] Training epoch: 40
[ Sat Oct 12 23:12:17 2024 ] 	Mean training loss: 1.6267.  Mean training acc: 57.07%.
[ Sat Oct 12 23:12:17 2024 ] 	Time consumption: [Data]01%, [Network]99%
[ Sat Oct 12 23:12:17 2024 ] Eval epoch: 40
[ Sat Oct 12 23:13:14 2024 ] 	Mean test loss of 16 batches: 1.476940918713808.
[ Sat Oct 12 23:13:14 2024 ] 	Top1: 59.80%
[ Sat Oct 12 23:13:14 2024 ] 	Top5: 86.50%
[ Sat Oct 12 23:13:14 2024 ] Training epoch: 41
[ Sat Oct 12 23:22:31 2024 ] 	Mean training loss: 1.6017.  Mean training acc: 57.93%.
[ Sat Oct 12 23:22:31 2024 ] 	Time consumption: [Data]01%, [Network]99%
[ Sat Oct 12 23:22:32 2024 ] Eval epoch: 41
[ Sat Oct 12 23:23:29 2024 ] 	Mean test loss of 16 batches: 1.4813046976923943.
[ Sat Oct 12 23:23:29 2024 ] 	Top1: 59.35%
[ Sat Oct 12 23:23:29 2024 ] 	Top5: 86.25%
[ Sat Oct 12 23:23:29 2024 ] Training epoch: 42
[ Sat Oct 12 23:32:48 2024 ] 	Mean training loss: 1.5778.  Mean training acc: 58.61%.
[ Sat Oct 12 23:32:48 2024 ] 	Time consumption: [Data]01%, [Network]99%
[ Sat Oct 12 23:32:48 2024 ] Eval epoch: 42
[ Sat Oct 12 23:33:46 2024 ] 	Mean test loss of 16 batches: 1.4840167760849.
[ Sat Oct 12 23:33:46 2024 ] 	Top1: 59.35%
[ Sat Oct 12 23:33:46 2024 ] 	Top5: 86.70%
[ Sat Oct 12 23:33:46 2024 ] Training epoch: 43
[ Sat Oct 12 23:43:05 2024 ] 	Mean training loss: 1.5387.  Mean training acc: 59.76%.
[ Sat Oct 12 23:43:05 2024 ] 	Time consumption: [Data]01%, [Network]99%
[ Sat Oct 12 23:43:05 2024 ] Eval epoch: 43
[ Sat Oct 12 23:44:02 2024 ] 	Mean test loss of 16 batches: 1.507052257657051.
[ Sat Oct 12 23:44:02 2024 ] 	Top1: 59.35%
[ Sat Oct 12 23:44:02 2024 ] 	Top5: 85.95%
[ Sat Oct 12 23:44:02 2024 ] Training epoch: 44
[ Sat Oct 12 23:53:17 2024 ] 	Mean training loss: 1.5134.  Mean training acc: 60.30%.
[ Sat Oct 12 23:53:17 2024 ] 	Time consumption: [Data]01%, [Network]99%
[ Sat Oct 12 23:53:18 2024 ] Eval epoch: 44
[ Sat Oct 12 23:54:14 2024 ] 	Mean test loss of 16 batches: 1.5012631304562092.
[ Sat Oct 12 23:54:15 2024 ] 	Top1: 59.35%
[ Sat Oct 12 23:54:15 2024 ] 	Top5: 86.05%
[ Sat Oct 12 23:54:15 2024 ] Training epoch: 45
[ Sun Oct 13 00:03:31 2024 ] 	Mean training loss: 1.4886.  Mean training acc: 60.66%.
[ Sun Oct 13 00:03:31 2024 ] 	Time consumption: [Data]01%, [Network]99%
[ Sun Oct 13 00:03:31 2024 ] Eval epoch: 45
[ Sun Oct 13 00:04:28 2024 ] 	Mean test loss of 16 batches: 1.5413845218718052.
[ Sun Oct 13 00:04:28 2024 ] 	Top1: 59.40%
[ Sun Oct 13 00:04:28 2024 ] 	Top5: 85.45%
[ Sun Oct 13 00:04:28 2024 ] Training epoch: 46
[ Sun Oct 13 00:13:48 2024 ] 	Mean training loss: 1.4578.  Mean training acc: 61.56%.
[ Sun Oct 13 00:13:48 2024 ] 	Time consumption: [Data]01%, [Network]99%
[ Sun Oct 13 00:13:48 2024 ] Eval epoch: 46
[ Sun Oct 13 00:14:46 2024 ] 	Mean test loss of 16 batches: 1.515494879335165.
[ Sun Oct 13 00:14:46 2024 ] 	Top1: 59.25%
[ Sun Oct 13 00:14:46 2024 ] 	Top5: 86.15%
[ Sun Oct 13 00:14:46 2024 ] Training epoch: 47
[ Sun Oct 13 00:24:04 2024 ] 	Mean training loss: 1.4365.  Mean training acc: 62.03%.
[ Sun Oct 13 00:24:04 2024 ] 	Time consumption: [Data]01%, [Network]99%
[ Sun Oct 13 00:24:04 2024 ] Eval epoch: 47
[ Sun Oct 13 00:25:01 2024 ] 	Mean test loss of 16 batches: 1.5617635548114777.
[ Sun Oct 13 00:25:01 2024 ] 	Top1: 58.10%
[ Sun Oct 13 00:25:01 2024 ] 	Top5: 85.40%
[ Sun Oct 13 00:25:01 2024 ] Training epoch: 48
[ Sun Oct 13 00:34:21 2024 ] 	Mean training loss: 1.4145.  Mean training acc: 63.17%.
[ Sun Oct 13 00:34:21 2024 ] 	Time consumption: [Data]01%, [Network]99%
[ Sun Oct 13 00:34:21 2024 ] Eval epoch: 48
[ Sun Oct 13 00:35:19 2024 ] 	Mean test loss of 16 batches: 1.551561776548624.
[ Sun Oct 13 00:35:19 2024 ] 	Top1: 58.00%
[ Sun Oct 13 00:35:19 2024 ] 	Top5: 85.75%
[ Sun Oct 13 00:35:19 2024 ] Training epoch: 49
[ Sun Oct 13 00:44:37 2024 ] 	Mean training loss: 1.3985.  Mean training acc: 63.09%.
[ Sun Oct 13 00:44:37 2024 ] 	Time consumption: [Data]01%, [Network]99%
[ Sun Oct 13 00:44:37 2024 ] Eval epoch: 49
[ Sun Oct 13 00:45:34 2024 ] 	Mean test loss of 16 batches: 1.598804872483015.
[ Sun Oct 13 00:45:34 2024 ] 	Top1: 57.70%
[ Sun Oct 13 00:45:34 2024 ] 	Top5: 85.10%
[ Sun Oct 13 00:45:34 2024 ] Training epoch: 50
[ Sun Oct 13 00:54:54 2024 ] 	Mean training loss: 1.3660.  Mean training acc: 64.12%.
[ Sun Oct 13 00:54:54 2024 ] 	Time consumption: [Data]01%, [Network]99%
[ Sun Oct 13 00:54:54 2024 ] Eval epoch: 50
[ Sun Oct 13 00:55:51 2024 ] 	Mean test loss of 16 batches: 1.617277331650257.
[ Sun Oct 13 00:55:51 2024 ] 	Top1: 57.25%
[ Sun Oct 13 00:55:51 2024 ] 	Top5: 85.00%
[ Sun Oct 13 00:55:51 2024 ] Training epoch: 51
[ Sun Oct 13 01:05:09 2024 ] 	Mean training loss: 1.3483.  Mean training acc: 64.25%.
[ Sun Oct 13 01:05:09 2024 ] 	Time consumption: [Data]01%, [Network]99%
[ Sun Oct 13 01:05:09 2024 ] Eval epoch: 51
[ Sun Oct 13 01:06:06 2024 ] 	Mean test loss of 16 batches: 1.6046022549271584.
[ Sun Oct 13 01:06:06 2024 ] 	Top1: 58.25%
[ Sun Oct 13 01:06:06 2024 ] 	Top5: 85.70%
[ Sun Oct 13 01:06:06 2024 ] Training epoch: 52
[ Sun Oct 13 01:15:23 2024 ] 	Mean training loss: 1.3251.  Mean training acc: 64.92%.
[ Sun Oct 13 01:15:23 2024 ] 	Time consumption: [Data]01%, [Network]99%
[ Sun Oct 13 01:15:24 2024 ] Eval epoch: 52
[ Sun Oct 13 01:16:21 2024 ] 	Mean test loss of 16 batches: 1.6174675785005093.
[ Sun Oct 13 01:16:21 2024 ] 	Top1: 58.35%
[ Sun Oct 13 01:16:21 2024 ] 	Top5: 84.70%
[ Sun Oct 13 01:16:21 2024 ] Training epoch: 53
[ Sun Oct 13 01:25:37 2024 ] 	Mean training loss: 1.2985.  Mean training acc: 65.62%.
[ Sun Oct 13 01:25:37 2024 ] 	Time consumption: [Data]01%, [Network]99%
[ Sun Oct 13 01:25:37 2024 ] Eval epoch: 53
[ Sun Oct 13 01:26:34 2024 ] 	Mean test loss of 16 batches: 1.6769529394805431.
[ Sun Oct 13 01:26:34 2024 ] 	Top1: 55.60%
[ Sun Oct 13 01:26:34 2024 ] 	Top5: 84.35%
[ Sun Oct 13 01:26:34 2024 ] Training epoch: 54
[ Sun Oct 13 01:35:53 2024 ] 	Mean training loss: 1.2857.  Mean training acc: 65.96%.
[ Sun Oct 13 01:35:53 2024 ] 	Time consumption: [Data]01%, [Network]99%
[ Sun Oct 13 01:35:53 2024 ] Eval epoch: 54
[ Sun Oct 13 01:36:51 2024 ] 	Mean test loss of 16 batches: 1.653071016073227.
[ Sun Oct 13 01:36:51 2024 ] 	Top1: 58.15%
[ Sun Oct 13 01:36:51 2024 ] 	Top5: 84.70%
[ Sun Oct 13 01:36:51 2024 ] Training epoch: 55
[ Sun Oct 13 01:46:05 2024 ] 	Mean training loss: 1.2554.  Mean training acc: 66.86%.
[ Sun Oct 13 01:46:05 2024 ] 	Time consumption: [Data]01%, [Network]99%
[ Sun Oct 13 01:46:05 2024 ] Eval epoch: 55
[ Sun Oct 13 01:47:02 2024 ] 	Mean test loss of 16 batches: 1.7032872512936592.
[ Sun Oct 13 01:47:02 2024 ] 	Top1: 56.30%
[ Sun Oct 13 01:47:02 2024 ] 	Top5: 84.40%
[ Sun Oct 13 01:47:02 2024 ] Training epoch: 56
[ Sun Oct 13 01:56:23 2024 ] 	Mean training loss: 1.1156.  Mean training acc: 70.84%.
[ Sun Oct 13 01:56:23 2024 ] 	Time consumption: [Data]01%, [Network]99%
[ Sun Oct 13 01:56:23 2024 ] Eval epoch: 56
[ Sun Oct 13 01:57:20 2024 ] 	Mean test loss of 16 batches: 1.5982569195330143.
[ Sun Oct 13 01:57:20 2024 ] 	Top1: 58.75%
[ Sun Oct 13 01:57:20 2024 ] 	Top5: 84.85%
[ Sun Oct 13 01:57:20 2024 ] Training epoch: 57
[ Sun Oct 13 02:06:36 2024 ] 	Mean training loss: 1.0694.  Mean training acc: 72.19%.
[ Sun Oct 13 02:06:36 2024 ] 	Time consumption: [Data]01%, [Network]99%
[ Sun Oct 13 02:06:37 2024 ] Eval epoch: 57
[ Sun Oct 13 02:07:34 2024 ] 	Mean test loss of 16 batches: 1.600387990474701.
[ Sun Oct 13 02:07:34 2024 ] 	Top1: 58.95%
[ Sun Oct 13 02:07:34 2024 ] 	Top5: 85.40%
[ Sun Oct 13 02:07:34 2024 ] Training epoch: 58
[ Sun Oct 13 02:16:52 2024 ] 	Mean training loss: 1.0448.  Mean training acc: 73.39%.
[ Sun Oct 13 02:16:52 2024 ] 	Time consumption: [Data]01%, [Network]99%
[ Sun Oct 13 02:16:52 2024 ] Eval epoch: 58
[ Sun Oct 13 02:17:50 2024 ] 	Mean test loss of 16 batches: 1.5897859148681164.
[ Sun Oct 13 02:17:50 2024 ] 	Top1: 58.75%
[ Sun Oct 13 02:17:50 2024 ] 	Top5: 85.15%
[ Sun Oct 13 02:17:50 2024 ] Training epoch: 59
[ Sun Oct 13 02:27:03 2024 ] 	Mean training loss: 1.0245.  Mean training acc: 74.02%.
[ Sun Oct 13 02:27:03 2024 ] 	Time consumption: [Data]01%, [Network]99%
[ Sun Oct 13 02:27:04 2024 ] Eval epoch: 59
[ Sun Oct 13 02:28:00 2024 ] 	Mean test loss of 16 batches: 1.5846507959067822.
[ Sun Oct 13 02:28:00 2024 ] 	Top1: 59.45%
[ Sun Oct 13 02:28:00 2024 ] 	Top5: 85.45%
[ Sun Oct 13 02:28:00 2024 ] Training epoch: 60
[ Sun Oct 13 02:37:14 2024 ] 	Mean training loss: 1.0054.  Mean training acc: 74.71%.
[ Sun Oct 13 02:37:14 2024 ] 	Time consumption: [Data]01%, [Network]99%
[ Sun Oct 13 02:37:14 2024 ] Eval epoch: 60
[ Sun Oct 13 02:38:11 2024 ] 	Mean test loss of 16 batches: 1.5984608344733715.
[ Sun Oct 13 02:38:11 2024 ] 	Top1: 58.95%
[ Sun Oct 13 02:38:11 2024 ] 	Top5: 85.75%
[ Sun Oct 13 02:38:11 2024 ] Training epoch: 61
[ Sun Oct 13 02:47:24 2024 ] 	Mean training loss: 1.0034.  Mean training acc: 74.49%.
[ Sun Oct 13 02:47:24 2024 ] 	Time consumption: [Data]01%, [Network]99%
[ Sun Oct 13 02:47:24 2024 ] Eval epoch: 61
[ Sun Oct 13 02:48:21 2024 ] 	Mean test loss of 16 batches: 1.5918404199182987.
[ Sun Oct 13 02:48:21 2024 ] 	Top1: 59.35%
[ Sun Oct 13 02:48:21 2024 ] 	Top5: 85.15%
[ Sun Oct 13 02:48:21 2024 ] Training epoch: 62
[ Sun Oct 13 02:57:39 2024 ] 	Mean training loss: 0.9909.  Mean training acc: 74.85%.
[ Sun Oct 13 02:57:39 2024 ] 	Time consumption: [Data]01%, [Network]99%
[ Sun Oct 13 02:57:39 2024 ] Eval epoch: 62
[ Sun Oct 13 02:58:36 2024 ] 	Mean test loss of 16 batches: 1.5945947729051113.
[ Sun Oct 13 02:58:36 2024 ] 	Top1: 58.70%
[ Sun Oct 13 02:58:36 2024 ] 	Top5: 85.10%
[ Sun Oct 13 02:58:36 2024 ] Training epoch: 63
[ Sun Oct 13 03:07:51 2024 ] 	Mean training loss: 0.9787.  Mean training acc: 75.09%.
[ Sun Oct 13 03:07:51 2024 ] 	Time consumption: [Data]01%, [Network]99%
[ Sun Oct 13 03:07:51 2024 ] Eval epoch: 63
[ Sun Oct 13 03:08:47 2024 ] 	Mean test loss of 16 batches: 1.5908109694719315.
[ Sun Oct 13 03:08:47 2024 ] 	Top1: 59.40%
[ Sun Oct 13 03:08:47 2024 ] 	Top5: 84.95%
[ Sun Oct 13 03:08:47 2024 ] Training epoch: 64
[ Sun Oct 13 03:18:01 2024 ] 	Mean training loss: 0.9795.  Mean training acc: 75.12%.
[ Sun Oct 13 03:18:01 2024 ] 	Time consumption: [Data]01%, [Network]99%
[ Sun Oct 13 03:18:01 2024 ] Eval epoch: 64
[ Sun Oct 13 03:18:58 2024 ] 	Mean test loss of 16 batches: 1.6070792265236378.
[ Sun Oct 13 03:18:58 2024 ] 	Top1: 59.30%
[ Sun Oct 13 03:18:58 2024 ] 	Top5: 85.65%
[ Sun Oct 13 03:18:58 2024 ] Training epoch: 65
[ Sun Oct 13 03:28:13 2024 ] 	Mean training loss: 0.9652.  Mean training acc: 75.34%.
[ Sun Oct 13 03:28:13 2024 ] 	Time consumption: [Data]01%, [Network]99%
[ Sun Oct 13 03:28:13 2024 ] Eval epoch: 65
[ Sun Oct 13 03:29:11 2024 ] 	Mean test loss of 16 batches: 1.6213399358093739.
[ Sun Oct 13 03:29:11 2024 ] 	Top1: 58.75%
[ Sun Oct 13 03:29:11 2024 ] 	Top5: 85.20%
[ Sun Oct 13 03:30:09 2024 ] Best accuracy: 0.598
[ Sun Oct 13 03:30:09 2024 ] Epoch number: 40
[ Sun Oct 13 03:30:09 2024 ] Model name: ./work_dir/uav/ctrgcn_motion_SNC_v2
[ Sun Oct 13 03:30:09 2024 ] Model total number of params: 1460911
[ Sun Oct 13 03:30:09 2024 ] Weight decay: 0.0004
[ Sun Oct 13 03:30:09 2024 ] Base LR: 0.1
[ Sun Oct 13 03:30:09 2024 ] Batch Size: 64
[ Sun Oct 13 03:30:09 2024 ] Test Batch Size: 128
[ Sun Oct 13 03:30:09 2024 ] seed: 1
[ Sun Oct 13 12:37:27 2024 ] Load weights from E:\Desktop\10-11-MS-CTR-GCN\work_dir\uav\ctrgcn_motion_SNC_v2\runs-40-10240.pt.
[ Sun Oct 13 12:37:28 2024 ] using warm up, epoch: 5
[ Sun Oct 13 18:13:05 2024 ] Load weights from E:\Desktop\≤‚ ‘\SNC-CTR-GCN\work_dir\uav\ctrgcn_motion_SNC_v2\runs-40-10240.pt.
[ Sun Oct 13 18:13:06 2024 ] using warm up, epoch: 5
[ Mon Oct 14 23:24:45 2024 ] Load weights from E:\Desktop\≤‚ ‘\SNC-CTR-GCN\work_dir\uav\ctrgcn_motion_SNC_v2\runs-40-10240.pt.
[ Mon Oct 14 23:24:47 2024 ] using warm up, epoch: 5
